{
  "$schema": "https://json-schema.org/draft/2020-12/schema",
  "$id": "weasel.schema.json",
  "title": "Weasel User Settings",
  "description": "Weasel-RS 用户设置文件",
  "type": "object",
  "properties": {
    "$schema": {
      "description": "JSON Schema 文件的 URI",
      "type": "string",
      "default": "weasel.schema.json"
    },
    "theme": {
      "description": "主题名称",
      "type": "string",
      "enum": [
        "eleven",
        "ten",
        "abc",
        "void",
        "wasm"
      ],
      "title": "主题",
      "default": "eleven"
    },
    "ascii_mode": {
      "description": "新输入会话默认使用英文模式",
      "type": "boolean",
      "title": "默认英文模式",
      "default": false
    },
    "global_ascii_status": {
      "description": "所有应用共享中英文状态",
      "type": "boolean",
      "title": "共享中英文状态",
      "default": false
    },
    "allow_rime_in_secure_fields": {
      "description": "关闭时，密码等安全输入区域将绕过 Rime 并直接交给应用。仅当密码包含必须通过输入法转换的内容（例如中文）时才建议开启。",
      "type": "boolean",
      "title": "允许 Rime 处理安全输入区域",
      "default": false
    },
    "inline_preedit": {
      "description": "是否在宿主编辑框内联显示预编辑文本",
      "type": "boolean",
      "title": "内联预编辑",
      "default": true
    },
    "preedit_type": {
      "description": "外部预编辑显示内容：composition 为编码，preview 为当前有效候选文本",
      "type": "string",
      "enum": [
        "composition",
        "preview"
      ],
      "title": "预编辑内容",
      "default": "composition"
    },
    "app_options": {
      "description": "按宿主程序文件名配置新输入会话的默认选项",
      "type": "object",
      "additionalProperties": {
        "type": "object",
        "properties": {
          "ascii_mode": {
            "description": "新会话默认使用英文模式；未指定时继承全局 ascii_mode，不覆盖已有会话的手动切换",
            "type": "boolean",
            "title": "默认英文模式"
          },
          "inline_preedit": {
            "description": "是否在该宿主编辑框内联显示预编辑文本；未指定时继承全局 inline_preedit，主题不支持外部预编辑时仍回退内联",
            "type": "boolean",
            "title": "内联预编辑"
          }
        },
        "additionalProperties": false
      },
      "examples": [
        {
          "cmd.exe": {
            "ascii_mode": true
          }
        }
      ],
      "title": "应用专属设置",
      "default": {
        "cmd.exe": {
          "ascii_mode": true
        },
        "conhost.exe": {
          "ascii_mode": true
        },
        "WindowsTerminal.exe": {
          "ascii_mode": true
        }
      }
    },
    "themeSettings": {
      "description": "按主题划分的自定义设置，键为主题名称，值为该主题的设置对象",
      "type": "object",
      "properties": {
        "wasm": {
          "type": "object",
          "properties": {
            "theme": {
              "type": "string",
              "pattern": "^[A-Za-z0-9_-]+$",
              "description": "加载同名 .wasm 模块",
              "title": "主题",
              "default": "weaselui"
            },
            "modules": {
              "type": "object",
              "propertyNames": {
                "pattern": "^[A-Za-z0-9_-]+$"
              },
              "additionalProperties": {
                "type": "object",
                "properties": {
                  "name": {
                    "type": "string",
                    "title": "名称"
                  },
                  "config": {
                    "type": "object",
                    "title": "配置"
                  },
                  "file": {
                    "type": "string",
                    "description": "模块路径；依次查找程序目录 theme-wasm/<id>.wasm、用户数据目录 <id>.wasm",
                    "title": "模块文件"
                  }
                },
                "additionalProperties": false
              },
              "title": "WASM 模块",
              "default": {
                "weaselui": {
                  "name": "旧版 Weasel UI"
                },
                "glass": {
                  "name": "Glass"
                },
                "orbit": {
                  "name": "Orbit · 月轨"
                },
                "statusbar": {
                  "name": "经典桌面状态栏"
                }
              }
            }
          },
          "additionalProperties": false,
          "default": {
            "theme": "weaselui",
            "modules": {
              "weaselui": {
                "name": "旧版 Weasel UI"
              },
              "glass": {
                "name": "Glass"
              },
              "orbit": {
                "name": "Orbit · 月轨"
              },
              "statusbar": {
                "name": "经典桌面状态栏"
              }
            }
          }
        }
      },
      "additionalProperties": {
        "type": "object"
      },
      "default": {
        "abc": {},
        "eleven": {},
        "wasm": {
          "theme": "weaselui",
          "modules": {
            "weaselui": {
              "name": "旧版 Weasel UI"
            },
            "glass": {
              "name": "Glass"
            },
            "orbit": {
              "name": "Orbit · 月轨"
            },
            "statusbar": {
              "name": "经典桌面状态栏"
            }
          }
        }
      }
    }
  },
  "additionalProperties": false,
  "examples": [
    {
      "theme": "eleven",
      "inline_preedit": true,
      "themeSettings": {
        "abc": {}
      }
    }
  ],
  "default": {
    "$schema": "weasel.schema.json",
    "theme": "eleven",
    "inline_preedit": true,
    "preedit_type": "composition",
    "ascii_mode": false,
    "global_ascii_status": false,
    "allow_rime_in_secure_fields": false,
    "themeSettings": {
      "abc": {},
      "eleven": {},
      "wasm": {
        "theme": "weaselui",
        "modules": {
          "weaselui": {
            "name": "旧版 Weasel UI"
          },
          "glass": {
            "name": "Glass"
          },
          "orbit": {
            "name": "Orbit · 月轨"
          },
          "statusbar": {
            "name": "经典桌面状态栏"
          }
        }
      }
    },
    "app_options": {
      "cmd.exe": {
        "ascii_mode": true
      },
      "conhost.exe": {
        "ascii_mode": true
      },
      "WindowsTerminal.exe": {
        "ascii_mode": true
      }
    }
  },
  "$comment": "Generated from the matching .richschema.json and .json; do not edit."
}
